{
  "$schema": "../_schemas/pack-manifest.schema.json",
  "id": "vocabpack-source-taxonomy",
  "pack_id": "cidv1-sha256-08328fb8c78e01b49475de4b9e60fe5efa990ce313ed248a70c8804dbcb9f35b",
  "kind": "vocabpack",
  "category": "VocabPack",
  "namespace": "source-taxonomy",
  "doc_id": "PACK-SOURCE-TAXONOMY",
  "version": "0.1.0",
  "status": "draft",
  "title": "Source Taxonomy Vocabulary Pack",
  "name": "Source Taxonomy Vocabulary Pack",
  "summary": "Starter taxonomy for infrastructure, repository, and volatility classes plus source tiers.",
  "compatible_core": {
    "min": "3.0.0",
    "max_exclusive": "4.0.0"
  },
  "entrypoints": {
    "examples": [
      "examples/tiering-and-trust.md"
    ],
    "schema": [],
    "shacl": [],
    "tests": [
      "tests/README.md"
    ],
    "vocab": [
      "vocab/source-taxonomy.ttl"
    ]
  },
  "dependsOn": [
    "stdpack-source-substrate"
  ],
  "depends_on": [
    {
      "doc_id": "PACK-SOURCE-SUBSTRATE",
      "version_range": "^0.1.0"
    }
  ],
  "owners": [
    {
      "name": "Entif/Rosetta maintainers",
      "role": "editor"
    }
  ],
  "exports": [
    {
      "kind": "vocab",
      "id": "source-taxonomy.vocab",
      "path": "vocab/source-taxonomy.ttl",
      "version": "0.1.0"
    }
  ],
  "profiles": [],
  "source_of_truth": {
    "doctrine": "Doctrine v0.2",
    "traceability_required": true
  }
}
