{
  "$schema": "../_schemas/pack-manifest.schema.json",
  "id": "schema-pack-evaluation-profiles",
  "pack_id": "cidv1-sha256-cdc4a3bfa7a06aa7c2e8d69468893ae256dd82685a165a35ad9841bba3eae0b8",
  "kind": "schema-pack",
  "category": "SchemaPack",
  "namespace": "salience",
  "doc_id": "ROCK-3010-SALIENCE-EVALUATION",
  "version": "0.1.0",
  "status": "draft",
  "title": "Evaluation Profiles Schema Pack",
  "name": "Evaluation Profiles Schema Pack",
  "summary": "Public representational Profiles over Core Evaluation: salience assessments and bounded historical counterfactual comparisons.",
  "compatible_core": {
    "min": "3.0.0",
    "max_exclusive": "4.0.0"
  },
  "entrypoints": {
    "examples": [
      "examples/salience-evaluation.json"
    ],
    "schema": [
      "schema/salience-evaluation.schema.json",
      "schema/counterfactual-evaluation.schema.json"
    ],
    "tests": [
      "tests/README.md",
      "test-vectors/salience/01-high-impact-exigency-low-novelty.json",
      "test-vectors/salience/02-low-impact-low-exigency-high-novelty-failure.json",
      "test-vectors/salience/03-aggregate-pattern.json",
      "test-vectors/salience/04-expected-absence.json",
      "test-vectors/salience/05-contradiction.json",
      "test-vectors/salience/06-historical-reassessment.json",
      "test-vectors/salience/07-unknown-insufficient-evidence.json",
      "test-vectors/salience/08-invalid-no-grant.json",
      "test-vectors/salience/09-interoperable-private-procedures.json",
      "test-vectors/counterfactual/01-equivalent.json",
      "test-vectors/counterfactual/02-missed-exception.json",
      "test-vectors/counterfactual/03-worse.json",
      "test-vectors/counterfactual/04-partial-replay.json",
      "test-vectors/counterfactual/05-later-evidence-excluded.json",
      "test-vectors/counterfactual/06-effect-rejected.json",
      "test-vectors/counterfactual/07-inconclusive.json",
      "test-vectors/counterfactual/08-preserved-reassessment.json",
      "test-vectors/counterfactual/09-invalid-activation.json"
    ]
  },
  "depends_on": [],
  "owners": [
    {
      "name": "Entif/Rosetta maintainers",
      "role": "editor"
    }
  ],
  "exports": [
    {
      "kind": "json-schema",
      "id": "salience.evaluation.v1",
      "path": "schema/salience-evaluation.schema.json",
      "version": "1.0.0",
      "profile": "salience.evaluation.v1"
    },
    {
      "kind": "json-schema",
      "id": "counterfactual.evaluation.v1",
      "path": "schema/counterfactual-evaluation.schema.json",
      "version": "1.0.0",
      "profile": "counterfactual.evaluation.v1"
    }
  ],
  "profiles": [
    {
      "name": "salience.evaluation.v1",
      "path": "schema/salience-evaluation.schema.json"
    },
    {
      "name": "counterfactual.evaluation.v1",
      "path": "schema/counterfactual-evaluation.schema.json"
    }
  ],
  "source_of_truth": {
    "doctrine": "Rosetta v3.0.0 Core Spine; public evaluation Profiles #1694 and #1695",
    "traceability_required": true
  }
}
